{
  "$schema": "https://json-schema.org/draft/2020-12/schema",
  "$id": "https://github.com/pharmacolog/syslog-generator/schemas/profile.schema.json",
  "title": "syslog-generator profile",
  "description": "Схема профиля нагрузки для syslog-generator (D3, v8.5.0; расширено F15 v9.2.0 для cef/leef/json_lines; F17 v9.4.0 — anomalies). Семантические правила (диапазоны facility/severity, веса шаблонов, наличие условий остановки фазы и т.п.) проверяются рантайм-валидатором validate.rs; эта схема ловит только структурные ошибки и ошибки типов.",
  "type": "object",
  "$defs": {
    "TargetConfig": {
      "type": "object",
      "additionalProperties": false,
      "required": ["address", "transport"],
      "properties": {
        "address": {
          "type": "string",
          "minLength": 1,
          "description": "Адрес target'а: для file — путь к файлу; для tcp/udp/tls — host:port. tls_domain по умолчанию берёт host-часть."
        },
"transport": {
          "type": "string",
          "enum": ["tcp", "udp", "tls", "file", "kafka"],
          "description": "Транспорт доставки. Семантическая валидация (диапазоны и т.п.) — в validate.rs. `kafka` требует cargo build --features kafka."
        },
        "connections": {
          "type": "integer",
          "minimum": 1,
          "default": 1,
          "description": "Число воркеров в пуле на target. Семантика >=1 проверяется в F13."
        },
        "weight": {
          "type": "integer",
          "minimum": 0,
          "default": 1,
          "description": "Вес для distribution=weighted (F2)."
        },
        "framing": {
          "type": "string",
          "enum": ["non-transparent", "octet-counting", "octet_counting", "octet"],
          "default": "non-transparent",
          "description": "Фрейминг для потоковых транспортов по RFC 6587. Для udp/file игнорируется."
        },
        "tls_domain": {
          "type": ["string", "null"],
          "minLength": 1,
          "description": "N4: имя хоста для SNI и проверки имени в сертификате. None → хост из address."
        },
        "tls_ca_file": {
          "type": ["string", "null"],
          "minLength": 1,
          "description": "N4: путь к PEM-файлу доверенного CA."
        },
        "tls_insecure": {
          "type": "boolean",
          "default": false,
          "description": "N4: opt-in в небезопасный режим (отключить проверку)."
        },
        "tls_client_cert_file": {
          "type": ["string", "null"],
          "minLength": 1,
          "description": "N4.mTLS (v8.7.2): путь к клиентскому PEM-сертификату для mTLS. Если задан, TLS-handshake предъявляет этот сертификат серверу. Парный файл — tls_client_key_file."
        },
        "tls_client_key_file": {
          "type": ["string", "null"],
          "minLength": 1,
          "description": "N4.mTLS: путь к клиентскому PEM-ключу (PKCS#8). Должен соответствовать сертификату из tls_client_cert_file."
        },
        "tls_min_protocol_version": {
          "type": ["string", "null"],
          "enum": ["1.2", "1.3", null],
          "description": "N4.mTLS: минимально допустимая версия TLS-протокола. Защита от downgrade-атак (None = системная, обычно 1.0)."
        },
        "kafka_topic": {
          "type": ["string", "null"],
          "minLength": 1,
          "description": "F16 (v9.3.0): Kafka topic. Обязателен если transport=\"kafka\". Требует cargo build --features kafka."
        },
        "kafka_client_id": {
          "type": ["string", "null"],
          "minLength": 1,
          "description": "F16: Kafka client_id (для логов брокера). None → \"syslog-generator\"."
        },
        "kafka_compression": {
          "type": ["string", "null"],
          "enum": ["none", "gzip", "snappy", "lz4", "zstd", null],
          "description": "F16: тип сжатия для Kafka-сообщений."
        },
        "kafka_acks": {
          "type": ["string", "null"],
          "enum": ["0", "1", "all", null],
          "description": "F16: Kafka acks (forward-compat; в rskafka 0.5 контролируется на стороне брокера)."
        },
        "kafka_linger_ms": {
          "type": ["integer", "null"],
          "minimum": 0,
          "description": "F16: задержка перед flush батча в Kafka (мс). None → 5."
        },
        "kafka_max_batch_size": {
          "type": ["integer", "null"],
          "minimum": 1,
          "description": "F16: максимальный размер батча Kafka (число записей). None → 1024."
        },
        "udp_batch_size": {
          "type": ["integer", "null"],
          "minimum": 1,
          "description": "Issue #162 (A5 adaptive batching): максимальный batch size для UDP datagrams. None → 1 (legacy single-datagram path). Some(64) → собрать до 64 datagrams, отправить batch. Снижает syscall overhead на high-throughput workloads."
        },
        "file_rotation_size_mb": {
          "type": ["integer", "null"],
          "minimum": 1,
          "description": "F16: ротация файла по размеру (МБ). None → без ротации по размеру. Применяется только для transport=\"file\"."
        },
        "file_rotation_interval_secs": {
          "type": ["integer", "null"],
          "minimum": 1,
          "description": "F16: ротация файла по интервалу (сек). None → без ротации по времени."
        },
        "file_rotation_max_files": {
          "type": ["integer", "null"],
          "minimum": 1,
          "description": "F16: максимум файлов (текущий + ротированные). None → 10. Старые сверх лимита удаляются (LRU)."
        },
        "reconnect_max_attempts": {
          "type": ["integer", "null"],
          "minimum": 0,
          "description": "F16: максимум попыток reconnect (TCP/TLS). None → бесконечно. 0 → отключить auto-reconnect."
        },
        "reconnect_initial_backoff_ms": {
          "type": ["integer", "null"],
          "minimum": 1,
          "description": "F16: начальная задержка между попытками reconnect (мс). None → 100."
        },
        "reconnect_max_backoff_ms": {
          "type": ["integer", "null"],
          "minimum": 1,
          "description": "F16: максимальная задержка между попытками reconnect (мс). None → 30000."
        },
        "reconnect_multiplier": {
          "type": ["number", "null"],
          "minimum": 1.0,
          "description": "F16: множитель backoff (backoff *= multiplier после каждой попытки). None → 2.0."
        },
        "tls_cipher_suites": {
          "type": ["array", "null"],
          "items": { "type": "string", "minLength": 1 },
          "description": "N4.cipher_policy (v9.5.0): IANA-имена cipher suites (напр. [\"TLS_AES_256_GCM_SHA384\", \"TLS_CHACHA20_POLY1305_SHA256\"]). None → дефолтный набор rustls. Семантика (известность rustls) проверяется в validate.rs.",
          "examples": [
            ["TLS_AES_256_GCM_SHA384", "TLS_CHACHA20_POLY1305_SHA256"],
            ["TLS_ECDHE_RSA_WITH_AES_256_GCM_SHA384"]
          ]
        }
      }
    },
    "SyslogConfig": {
      "type": "object",
      "additionalProperties": false,
      "properties": {
        "facility": { "type": "integer", "minimum": 0, "maximum": 23, "default": 1 },
        "severity": { "type": "integer", "minimum": 0, "maximum": 7, "default": 6 },
        "hostname": { "type": "string", "default": "{{hostname}}" },
        "app_name": { "type": "string", "default": "syslog-generator" },
        "procid": { "type": "string", "default": "-" },
        "msgid": { "type": "string", "default": "-" },
        "structured_data": { "type": "string", "default": "-" },
        "bom": { "type": "boolean", "default": false }
      }
    },
    "ShutdownConfig": {
      "type": "object",
      "additionalProperties": false,
      "properties": {
        "mode": { "type": "string", "enum": ["drain", "immediate"], "default": "drain" },
        "drain_timeout_secs": { "type": "integer", "minimum": 0, "default": 15 }
      }
    },
    "ProtobufSchemaFieldMap": {
      "oneOf": [
        { "type": "null" },
        { "type": "object", "additionalProperties": false, "properties": { "fields": { "type": "object", "additionalProperties": { "type": "string" } } } }
      ]
    },
    "CefConfig": {
      "type": ["object", "null"],
      "additionalProperties": false,
      "required": ["device_vendor", "device_product", "device_version", "signature_id", "name"],
      "properties": {
        "device_vendor": { "type": "string", "minLength": 1 },
        "device_product": { "type": "string", "minLength": 1 },
        "device_version": { "type": "string", "minLength": 1 },
        "signature_id": { "type": "string", "minLength": 1 },
        "name": { "type": "string", "minLength": 1 },
        "severity": { "type": ["integer", "null"], "minimum": 0, "maximum": 10 },
        "extensions": {
          "type": ["object", "null"],
          "additionalProperties": { "type": "string" },
          "description": "CEF extension key=value pairs. Значения проходят подстановку шаблона."
        }
      },
      "description": "F15: конфигурация ArcSight CEF (формат phase.format=cef). Семантика непустых полей проверяется в validate.rs."
    },
    "LeefConfig": {
      "type": ["object", "null"],
      "additionalProperties": false,
      "required": ["vendor", "product", "version", "event_id"],
      "properties": {
        "vendor": { "type": "string", "minLength": 1 },
        "product": { "type": "string", "minLength": 1 },
        "version": { "type": "string", "minLength": 1 },
        "event_id": { "type": "string", "minLength": 1 },
        "attributes": {
          "type": ["object", "null"],
          "additionalProperties": { "type": "string" },
          "description": "LEEF attribute key=value pairs. Значения проходят подстановку шаблона."
        }
      },
      "description": "F15: конфигурация IBM QRadar LEEF (формат phase.format=leef)."
    },
    "LoadShape": {
      "oneOf": [
        { "type": "null" },
        { "type": "object", "additionalProperties": false, "required": ["type"], "properties": { "type": { "const": "constant" }, "rate": { "type": "number", "minimum": 0 } } },
        { "type": "object", "additionalProperties": false, "required": ["type"], "properties": { "type": { "const": "linear" }, "start_rate": { "type": "number", "minimum": 0 }, "end_rate": { "type": "number", "minimum": 0 } } },
        { "type": "object", "additionalProperties": false, "required": ["type"], "properties": { "type": { "const": "sine" }, "min_rate": { "type": "number", "minimum": 0 }, "max_rate": { "type": "number", "minimum": 0 }, "period_secs": { "type": "number", "exclusiveMinimum": 0 } } },
        { "type": "object", "additionalProperties": false, "required": ["type"], "properties": { "type": { "const": "burst" }, "base_rate": { "type": "number", "minimum": 0 }, "burst_rate": { "type": "number", "minimum": 0 }, "every_secs": { "type": "number", "exclusiveMinimum": 0 }, "burst_secs": { "type": "number", "minimum": 0 } } }
      ]
    },
    "Anomaly": {
      "description": "F17 (v9.4.0): сценарий аномалии (тегируется полем type).",
      "oneOf": [
        {
          "type": "object",
          "additionalProperties": false,
          "required": ["type"],
          "properties": {
            "type": { "const": "burst-injection" },
            "rate_multiplier": { "type": "number", "exclusiveMinimum": 0 },
            "interval_secs": { "type": "number", "exclusiveMinimum": 0 },
            "duration_secs": { "type": "number", "minimum": 0 }
          }
        },
        {
          "type": "object",
          "additionalProperties": false,
          "required": ["type"],
          "properties": {
            "type": { "const": "slow-drip" },
            "rate_divisor": { "type": "number", "exclusiveMinimum": 1 },
            "duration_secs": { "type": "number", "exclusiveMinimum": 0 }
          }
        },
        {
          "type": "object",
          "additionalProperties": false,
          "required": ["type"],
          "properties": {
            "type": { "const": "packet-loss" },
            "loss_percent": { "type": "number", "minimum": 0, "maximum": 100 }
          }
        }
      ]
    },
    "Phase": {
      "type": "object",
      "additionalProperties": false,
      "required": ["name"],
      "properties": {
        "name": { "type": "string", "minLength": 1 },
        "duration_secs": { "type": "integer", "minimum": 0, "default": 0 },
        "messages_per_second": { "type": "integer", "minimum": 0, "default": 0 },
        "total_messages": { "type": ["integer", "null"], "minimum": 1 },
        "templates": {
          "type": "array",
          "items": { "type": "string", "minLength": 1 },
          "description": "Массив шаблонов (не сериализуется, если пустой — тогда требуется templates_file или schema_file)."
        },
        "templates_file": {
          "type": ["string", "null"],
          "minLength": 1,
          "description": "Путь к файлу с шаблонами (альтернатива templates)."
        },
        "schema_file": {
          "type": ["string", "null"],
          "minLength": 1,
          "description": "Путь к schema.json (F5)."
        },
        "format": {
          "type": ["string", "null"],
          "enum": ["rfc5424", "rfc3164", "raw", "protobuf", "cef", "leef", "json_lines", null]
        },
        "output": { "type": ["string", "null"], "minLength": 1 },
        "seed": { "type": ["integer", "null"], "minimum": 0 },
        "protobuf_schema": { "$ref": "#/$defs/ProtobufSchemaFieldMap" },
        "syslog": { "$ref": "#/$defs/SyslogConfig" },
        "load_shape": { "$ref": "#/$defs/LoadShape" },
        "anomalies": {
          "type": ["array", "null"],
          "items": { "$ref": "#/$defs/Anomaly" },
          "description": "F17 (v9.4.0): сценарии аномалий нагрузки (burst-injection, slow-drip, packet-loss)."
        },
        "template_weights": { "type": ["array", "null"], "items": { "type": "number" } },
        "pad_to_bytes": { "type": ["integer", "null"], "minimum": 1 },
        "cef": { "$ref": "#/$defs/CefConfig" },
        "leef": { "$ref": "#/$defs/LeefConfig" },
        "json_lines_fields": {
          "type": ["object", "null"],
          "additionalProperties": { "type": "string" },
          "description": "F15: дополнительные поля верхнего уровня для json_lines формата."
        }
      },
      "anyOf": [
        { "required": ["templates"] },
        { "required": ["templates_file"] },
        { "required": ["schema_file"] }
      ]
    },
    "Distribution": {
      "type": "string",
      "enum": ["round-robin", "broadcast", "weighted"]
    },
    "RuntimeConfig": {
      "type": "object",
      "additionalProperties": false,
      "properties": {
        "generator_mode": { "type": ["string", "null"], "enum": ["deterministic", "fast", null] },
        "generator_threads": { "type": ["integer", "null"], "minimum": 1, "maximum": 4096 },
        "queue_capacity": { "type": ["integer", "null"], "minimum": 1, "maximum": 1048576 },
        "batch_size": { "type": ["integer", "null"], "minimum": 1, "maximum": 1048576 },
        "pacer_tick_interval_ms": { "type": ["integer", "null"], "minimum": 1, "maximum": 60000 }
      }
    }
  },
  "additionalProperties": false,
  "properties": {
    "targets": { "type": "array", "items": { "$ref": "#/$defs/TargetConfig" } },
    "distribution": { "$ref": "#/$defs/Distribution" },
    "shutdown": { "$ref": "#/$defs/ShutdownConfig" },
    "phases": { "type": "array", "items": { "$ref": "#/$defs/Phase" }, "minItems": 1 },
    "metrics_addr": { "type": ["string", "null"] },
    "broadcast_policy": { "type": ["string", "null"], "enum": ["strict", "independent", "best-effort", null] },
    "queue_capacity": { "type": ["integer", "null"], "minimum": 1, "maximum": 1048576 },
    "on_target_failure": { "type": ["string", "null"], "enum": ["fail-phase", "continue", "disable-target", null] },
    "runtime": { "$ref": "#/$defs/RuntimeConfig" }
  }
}